{"acceptance_matrix":[{"passed":true,"required_checks":["PROVENANCE_BOUND","STATE_EVIDENCE_EXPLICIT","PROTECTED_VIEW_SET_COMPLETE","PAYLOAD_HASHES_VERIFIED","SHAPE_IDENTICAL","CANONICAL_BYTES_IDENTICAL","EBUS_AUTHORITY_PRESERVED","CANDIDATE_CONFINED","PUBLIC_REDACTION_ENFORCED","V1_SURFACES_PRESERVED","G18_SCOPE_ONLY"],"state":"EEBUS_DISABLED_BASELINE"},{"passed":true,"required_checks":["PROVENANCE_BOUND","STATE_EVIDENCE_EXPLICIT","PROTECTED_VIEW_SET_COMPLETE","PAYLOAD_HASHES_VERIFIED","SHAPE_IDENTICAL","CANONICAL_BYTES_IDENTICAL","EBUS_AUTHORITY_PRESERVED","CANDIDATE_CONFINED","PUBLIC_REDACTION_ENFORCED","V1_SURFACES_PRESERVED","G18_SCOPE_ONLY"],"state":"EEBUS_DISABLED_CONFIRMED"},{"passed":true,"required_checks":["PROVENANCE_BOUND","STATE_EVIDENCE_EXPLICIT","PROTECTED_VIEW_SET_COMPLETE","PAYLOAD_HASHES_VERIFIED","SHAPE_IDENTICAL","CANONICAL_BYTES_IDENTICAL","EBUS_AUTHORITY_PRESERVED","CANDIDATE_CONFINED","PUBLIC_REDACTION_ENFORCED","V1_SURFACES_PRESERVED","G18_SCOPE_ONLY"],"state":"EEBUS_ENABLED_NO_SERVICES"},{"passed":true,"required_checks":["PROVENANCE_BOUND","STATE_EVIDENCE_EXPLICIT","PROTECTED_VIEW_SET_COMPLETE","PAYLOAD_HASHES_VERIFIED","SHAPE_IDENTICAL","CANONICAL_BYTES_IDENTICAL","EBUS_AUTHORITY_PRESERVED","CANDIDATE_CONFINED","PUBLIC_REDACTION_ENFORCED","V1_SURFACES_PRESERVED","G18_SCOPE_ONLY"],"state":"EEBUS_CONNECTED_CANDIDATE_ONLY"},{"passed":true,"required_checks":["PROVENANCE_BOUND","STATE_EVIDENCE_EXPLICIT","PROTECTED_VIEW_SET_COMPLETE","PAYLOAD_HASHES_VERIFIED","SHAPE_IDENTICAL","CANONICAL_BYTES_IDENTICAL","EBUS_AUTHORITY_PRESERVED","CANDIDATE_CONFINED","PUBLIC_REDACTION_ENFORCED","V1_SURFACES_PRESERVED","G18_SCOPE_ONLY"],"state":"EEBUS_CONFLICTED_WITHHELD"},{"passed":true,"required_checks":["PROVENANCE_BOUND","STATE_EVIDENCE_EXPLICIT","PROTECTED_VIEW_SET_COMPLETE","PAYLOAD_HASHES_VERIFIED","SHAPE_IDENTICAL","CANONICAL_BYTES_IDENTICAL","EBUS_AUTHORITY_PRESERVED","CANDIDATE_CONFINED","PUBLIC_REDACTION_ENFORCED","V1_SURFACES_PRESERVED","G18_SCOPE_ONLY"],"state":"EEBUS_DISABLED_ROLLBACK"}],"baseline":{"artifact_digest":"sha256:cccccccccccccccccccccccccccccccccccccccccccccccccccccccccccccccc","run_id":"msp08-run-01","source_commit":"ff511b035b85aef6123fb0853bb3d2f3af6fc01e","state":"EEBUS_DISABLED_BASELINE","view_hashes":[{"canonical_payload_hash":"sha256:3c757b1ec4b2e32599db23f9a64b73d7e2724185bc86dcec49f6f3c26f3d4522","shape_hash":"sha256:9cac64ac32169b37ed5e8d25fa4d6c45a55d4dc90c1419797b1ef56416b999b4","view_id":"mcp.ebus.v1.responses"},{"canonical_payload_hash":"sha256:55c9c0ba40cfb9890bcef8e933cc6e72dc7f234d71c4e4ecd6466403cae3f28e","shape_hash":"sha256:08159a0095ba1b3261765a8834f36d38539116fae4ab4f70e15b20290d2f2ec6","view_id":"mcp.tool.inventory"},{"canonical_payload_hash":"sha256:e2eb726ac6123fb6bc13551a6a102d09c09037fbb8ae37b5d2ebb1c2ef79bb79","shape_hash":"sha256:e204b7c04ef26668df4f4a17cbf8bf2627ab72a18c3de484382f54a9cccc746c","view_id":"graphql.schema"},{"canonical_payload_hash":"sha256:ea4d0574109e39321db281ce92850b99406e96841d72dfb3e315973d4544cb7c","shape_hash":"sha256:57b5808074f85e77834665e65ed902a460cd1aef63fff9ec960d41e8a30abea9","view_id":"graphql.ebus.values"},{"canonical_payload_hash":"sha256:2fe08be06b967a57180e8f22d915bf80c6f825d728cb4baca6d5efd68d3648f3","shape_hash":"sha256:f1ad45ea32be178cef9e4a8e92e894927838eba3ad26b6e9701c93cb484e479f","view_id":"ha.graphql.values"},{"canonical_payload_hash":"sha256:5fc7e65226e99b1110ceaedf9c9cb522c303fd700314a2e7aaefd96b2da5d1a8","shape_hash":"sha256:cb8de60c05ca85a7645181d4aeafea26005520c1393e34a74ebaadb8d3217deb","view_id":"ha.identity"},{"canonical_payload_hash":"sha256:b9ba9dfeadb4a6dfb135c7f8d79c4853b7f65b981dca336f9856c342b3861727","shape_hash":"sha256:19971eb695a594456612db71d64852bf062070aef50d2041784cf4012dc78ef0","view_id":"debug.ebus"},{"canonical_payload_hash":"sha256:1afdce5bb08b84ad4286c4be1d6c122cdf636f0b5f55353fc4350d9c5bcdb222","shape_hash":"sha256:73f3085f7838aecfb948dfd86a2f45c4cafc6bd4b12b1ee89a26cece7a970f0e","view_id":"portal.ebus.bootstrap"},{"canonical_payload_hash":"sha256:2d87104125088c5ba2483f6e65357c5c384e597dea95f2dcd129e3054cef2a69","shape_hash":"sha256:96c1424052ba6e7e6bff1a3edfb5abc1203eb9ec3ded9155fca3fd061e0d34cd","view_id":"command.routing"},{"canonical_payload_hash":"sha256:3784857ae4713aee487edf5ec64c8b0cd0dae9922223433162198eb263b8d222","shape_hash":"sha256:456a805471cf61f51c911f1cfb962ba4a32dfadaea619254cb84c911dcd210ae","view_id":"semantic.registry"},{"canonical_payload_hash":"sha256:973ce845e74f25a721d8fad393232624db0e8303c016ecb8e9d43ab00a5ac957","shape_hash":"sha256:4662e4d5f1c1e4c9a81c9657778260c08917ed5dbb7e534cb015a9369c80965d","view_id":"mcp.eebus.v1.contract"}]},"contract":"helianthus.platform.multi-runtime-coexistence-report.v1","evidence_class":"SYNTHETIC_OFFLINE_FIXTURE","evidence_hash":"sha256:47eafc13038904aeba7c8eb7af4adbf50358bd98ac4a9fa05a510bc12101da75","evidence_id":"mrcv1:sha256:47eafc13038904aeba7c8eb7af4adbf50358bd98ac4a9fa05a510bc12101da75","export_tier":"PUBLIC_REDACTED","fixture_id":"MSP08-G18-SYNTHETIC-REPORT-001","gate":"EEBUS-G18","m7_binding":{"docs_source_commit":"ea88fef23ecb154b08f70e7f94b36e1738ed08bf","graph_hash":"sha256:00f2b3c48959605d311d0d3895ec924b475d8fa25ee4e236d32d6facbd32c4ac","graph_id":"dcfgv1:sha256:00f2b3c48959605d311d0d3895ec924b475d8fa25ee4e236d32d6facbd32c4ac","live_status_projection_hash":null,"live_status_projection_id":null,"replay_hash":"sha256:0d3d6c1b4d23e1a8dfe6137fd7956f2c0c3fa51009c1ebb9129807c9fd49850b","replay_id":"dcfrv1:sha256:0d3d6c1b4d23e1a8dfe6137fd7956f2c0c3fa51009c1ebb9129807c9fd49850b","source_commit":"ff511b035b85aef6123fb0853bb3d2f3af6fc01e"},"report_hash":"sha256:d4335511bd6a71b86667ce570ebb7fc57f8cef9d379582fcf08d156db0c3b76d","report_id":"mrcrv1:sha256:d4335511bd6a71b86667ce570ebb7fc57f8cef9d379582fcf08d156db0c3b76d","rollback":{"candidate_graph_disabled":true,"exact_baseline_restored":true,"run_id":"msp08-run-06","runtime_enabled":false},"scenarios":[{"checks":["PROVENANCE_BOUND","STATE_EVIDENCE_EXPLICIT","PROTECTED_VIEW_SET_COMPLETE","PAYLOAD_HASHES_VERIFIED","SHAPE_IDENTICAL","CANONICAL_BYTES_IDENTICAL","EBUS_AUTHORITY_PRESERVED","CANDIDATE_CONFINED","PUBLIC_REDACTION_ENFORCED","V1_SURFACES_PRESERVED","G18_SCOPE_ONLY"],"result":"NO_DRIFT","run_id":"msp08-run-02","state":"EEBUS_DISABLED_CONFIRMED","view_hashes":[{"canonical_payload_hash":"sha256:3c757b1ec4b2e32599db23f9a64b73d7e2724185bc86dcec49f6f3c26f3d4522","shape_hash":"sha256:9cac64ac32169b37ed5e8d25fa4d6c45a55d4dc90c1419797b1ef56416b999b4","view_id":"mcp.ebus.v1.responses"},{"canonical_payload_hash":"sha256:55c9c0ba40cfb9890bcef8e933cc6e72dc7f234d71c4e4ecd6466403cae3f28e","shape_hash":"sha256:08159a0095ba1b3261765a8834f36d38539116fae4ab4f70e15b20290d2f2ec6","view_id":"mcp.tool.inventory"},{"canonical_payload_hash":"sha256:e2eb726ac6123fb6bc13551a6a102d09c09037fbb8ae37b5d2ebb1c2ef79bb79","shape_hash":"sha256:e204b7c04ef26668df4f4a17cbf8bf2627ab72a18c3de484382f54a9cccc746c","view_id":"graphql.schema"},{"canonical_payload_hash":"sha256:ea4d0574109e39321db281ce92850b99406e96841d72dfb3e315973d4544cb7c","shape_hash":"sha256:57b5808074f85e77834665e65ed902a460cd1aef63fff9ec960d41e8a30abea9","view_id":"graphql.ebus.values"},{"canonical_payload_hash":"sha256:2fe08be06b967a57180e8f22d915bf80c6f825d728cb4baca6d5efd68d3648f3","shape_hash":"sha256:f1ad45ea32be178cef9e4a8e92e894927838eba3ad26b6e9701c93cb484e479f","view_id":"ha.graphql.values"},{"canonical_payload_hash":"sha256:5fc7e65226e99b1110ceaedf9c9cb522c303fd700314a2e7aaefd96b2da5d1a8","shape_hash":"sha256:cb8de60c05ca85a7645181d4aeafea26005520c1393e34a74ebaadb8d3217deb","view_id":"ha.identity"},{"canonical_payload_hash":"sha256:b9ba9dfeadb4a6dfb135c7f8d79c4853b7f65b981dca336f9856c342b3861727","shape_hash":"sha256:19971eb695a594456612db71d64852bf062070aef50d2041784cf4012dc78ef0","view_id":"debug.ebus"},{"canonical_payload_hash":"sha256:1afdce5bb08b84ad4286c4be1d6c122cdf636f0b5f55353fc4350d9c5bcdb222","shape_hash":"sha256:73f3085f7838aecfb948dfd86a2f45c4cafc6bd4b12b1ee89a26cece7a970f0e","view_id":"portal.ebus.bootstrap"},{"canonical_payload_hash":"sha256:2d87104125088c5ba2483f6e65357c5c384e597dea95f2dcd129e3054cef2a69","shape_hash":"sha256:96c1424052ba6e7e6bff1a3edfb5abc1203eb9ec3ded9155fca3fd061e0d34cd","view_id":"command.routing"},{"canonical_payload_hash":"sha256:3784857ae4713aee487edf5ec64c8b0cd0dae9922223433162198eb263b8d222","shape_hash":"sha256:456a805471cf61f51c911f1cfb962ba4a32dfadaea619254cb84c911dcd210ae","view_id":"semantic.registry"},{"canonical_payload_hash":"sha256:973ce845e74f25a721d8fad393232624db0e8303c016ecb8e9d43ab00a5ac957","shape_hash":"sha256:4662e4d5f1c1e4c9a81c9657778260c08917ed5dbb7e534cb015a9369c80965d","view_id":"mcp.eebus.v1.contract"}]},{"checks":["PROVENANCE_BOUND","STATE_EVIDENCE_EXPLICIT","PROTECTED_VIEW_SET_COMPLETE","PAYLOAD_HASHES_VERIFIED","SHAPE_IDENTICAL","CANONICAL_BYTES_IDENTICAL","EBUS_AUTHORITY_PRESERVED","CANDIDATE_CONFINED","PUBLIC_REDACTION_ENFORCED","V1_SURFACES_PRESERVED","G18_SCOPE_ONLY"],"result":"EXPECTED_NO_SERVICES_NO_DRIFT","run_id":"msp08-run-03","state":"EEBUS_ENABLED_NO_SERVICES","view_hashes":[{"canonical_payload_hash":"sha256:3c757b1ec4b2e32599db23f9a64b73d7e2724185bc86dcec49f6f3c26f3d4522","shape_hash":"sha256:9cac64ac32169b37ed5e8d25fa4d6c45a55d4dc90c1419797b1ef56416b999b4","view_id":"mcp.ebus.v1.responses"},{"canonical_payload_hash":"sha256:55c9c0ba40cfb9890bcef8e933cc6e72dc7f234d71c4e4ecd6466403cae3f28e","shape_hash":"sha256:08159a0095ba1b3261765a8834f36d38539116fae4ab4f70e15b20290d2f2ec6","view_id":"mcp.tool.inventory"},{"canonical_payload_hash":"sha256:e2eb726ac6123fb6bc13551a6a102d09c09037fbb8ae37b5d2ebb1c2ef79bb79","shape_hash":"sha256:e204b7c04ef26668df4f4a17cbf8bf2627ab72a18c3de484382f54a9cccc746c","view_id":"graphql.schema"},{"canonical_payload_hash":"sha256:ea4d0574109e39321db281ce92850b99406e96841d72dfb3e315973d4544cb7c","shape_hash":"sha256:57b5808074f85e77834665e65ed902a460cd1aef63fff9ec960d41e8a30abea9","view_id":"graphql.ebus.values"},{"canonical_pa